{
  "$schema": "../../../schemas/spells/v1.0.0/schema.json",
  "contract_version": "1.0.0",
  "id": "spells:necromancy-spell-0959",
  "slug": "necromancy-spell-0959",
  "family": "spells",
  "version": "1.0.0",
  "authority": "declarative",
  "intended_consumers": [
    "llm-pipeline",
    "zig-server-v2"
  ],
  "compatibility": [],
  "dependencies": [],
  "spec_checksum": "sha256:135d556a43f3af4c65a8df32edbe71cc52e8afadd337695a5f38751057d493c5",
  "spec": {
    "display_name": "Necromancy Spell 0959",
    "school": "necromancy",
    "rarity": "uncommon",
    "spell_kind": "accelerated-aging-debuff",
    "target_kind": "enemy-target"
  }
}
