{
  "$schema": "../../../schemas/monsters/v1.0.0/schema.json",
  "contract_version": "1.0.0",
  "id": "monsters:beast-creature-0178",
  "slug": "beast-creature-0178",
  "family": "monsters",
  "version": "1.0.0",
  "authority": "declarative",
  "intended_consumers": [
    "llm-pipeline",
    "zig-server-v2"
  ],
  "compatibility": [],
  "dependencies": [],
  "spec_checksum": "sha256:08b2c914aa49976b6330b2873ec06c615e2b0fad71e810a0d962887c1ce1ada3",
  "spec": {
    "display_name": "Beast Creature 0178",
    "category": "beast",
    "rarity": "rare"
  }
}
