{
  "$schema": "../../../schemas/spells/v1.0.0/schema.json",
  "contract_version": "1.0.0",
  "id": "spells:protection-spell-1219",
  "slug": "protection-spell-1219",
  "family": "spells",
  "version": "1.0.0",
  "authority": "declarative",
  "intended_consumers": [
    "llm-pipeline",
    "zig-server-v2"
  ],
  "compatibility": [],
  "dependencies": [],
  "spec_checksum": "sha256:aea8cb1683bad2acfb2844f3c772bb3c659ccab74d151637f78de007b70728d7",
  "spec": {
    "display_name": "Protection Spell 1219",
    "school": "protection",
    "rarity": "common",
    "spell_kind": "buff",
    "target_kind": "self"
  }
}
