{
  "$schema": "../../../schemas/spells/v1.0.0/schema.json",
  "contract_version": "1.0.0",
  "id": "spells:nut-spell-spell-0998",
  "slug": "nut-spell-spell-0998",
  "family": "spells",
  "version": "1.0.0",
  "authority": "declarative",
  "intended_consumers": [
    "llm-pipeline",
    "zig-server-v2"
  ],
  "compatibility": [],
  "dependencies": [],
  "spec_checksum": "sha256:116555236eac83c352d9510d5fa619cfa845f5feec45e798b28109d322f87140",
  "spec": {
    "display_name": "Nut Spell Spell 0998",
    "school": "nut-nut-spell-spell-0998",
    "rarity": "common",
    "spell_kind": "damage",
    "target_kind": "single"
  }
}
