{
  "$schema": "../../../schemas/spells/v1.0.0/schema.json",
  "contract_version": "1.0.0",
  "id": "spells:songweaver-spell-spell-1369",
  "slug": "songweaver-spell-spell-1369",
  "family": "spells",
  "version": "1.0.0",
  "authority": "declarative",
  "intended_consumers": [
    "llm-pipeline",
    "zig-server-v2"
  ],
  "compatibility": [],
  "dependencies": [],
  "spec_checksum": "sha256:4504dde74c7a4517a4b5d4580f9bb84d52a1b4d497e2eaa58ef48a821e12ce7b",
  "spec": {
    "display_name": "Songweaver Spell Spell 1369",
    "school": "songweaver-spell-spell-1369-spell",
    "rarity": "common",
    "spell_kind": "damage",
    "target_kind": "single"
  }
}
