{
  "$schema": "../../../schemas/items/v1.0.0/schema.json",
  "contract_version": "1.0.0",
  "id": "items:paradox-residue",
  "slug": "paradox-residue",
  "family": "items",
  "version": "1.0.0",
  "authority": "declarative",
  "intended_consumers": [
    "llm-pipeline",
    "zig-server-v2"
  ],
  "compatibility": [],
  "dependencies": [],
  "spec_checksum": "sha256:b41b15918cec5141c1ad00fb34cba562298875873f2a9eac54e7f1ba819b9a85",
  "spec": {
    "display_name": "Paradox Residue",
    "category": "quest-item",
    "rarity": "common",
    "item_kind": "quest-item",
    "subtype": "generic"
  }
}
