{
  "$schema": "../../../schemas/spells/v1.0.0/schema.json",
  "contract_version": "1.0.0",
  "id": "spells:defensive-spell-0888",
  "slug": "defensive-spell-0888",
  "family": "spells",
  "version": "1.0.0",
  "authority": "declarative",
  "intended_consumers": [
    "llm-pipeline",
    "zig-server-v2"
  ],
  "compatibility": [],
  "dependencies": [],
  "spec_checksum": "sha256:63b36e5f264b5629916f5579502c3117f201908afa14e3ed563653331f9b07ce",
  "spec": {
    "display_name": "Defensive Spell 0888",
    "school": "defensive",
    "rarity": "rare",
    "spell_kind": "damage-reduction-brew",
    "target_kind": "self-buff"
  }
}
