{
  "$schema": "../../../schemas/monsters/v1.0.0/schema.json",
  "contract_version": "1.0.0",
  "id": "monsters:monstrosity-creature-0219",
  "slug": "monstrosity-creature-0219",
  "family": "monsters",
  "version": "1.0.0",
  "authority": "declarative",
  "intended_consumers": [
    "llm-pipeline",
    "zig-server-v2"
  ],
  "compatibility": [],
  "dependencies": [],
  "spec_checksum": "sha256:a9f30d144038073b5eadc5ec080042f8a69e20e611a6b13a6d8cd274b8a3ef1e",
  "spec": {
    "display_name": "Monstrosity Creature 0219",
    "category": "monstrosity",
    "rarity": "epic"
  }
}
