{
  "$schema": "../../../schemas/spells/v1.0.0/schema.json",
  "contract_version": "1.0.0",
  "id": "spells:evocation-spell-1528",
  "slug": "evocation-spell-1528",
  "family": "spells",
  "version": "1.0.0",
  "authority": "declarative",
  "intended_consumers": [
    "llm-pipeline",
    "zig-server-v2"
  ],
  "compatibility": [],
  "dependencies": [],
  "spec_checksum": "sha256:8551879d1bcd6b62bf3d8e2eea30459dd8a26e7abebc07feb1acc440b21daa4b",
  "spec": {
    "display_name": "Evocation Spell 1528",
    "school": "evocation",
    "rarity": "legendary",
    "spell_kind": "area-damage",
    "target_kind": "area"
  }
}
