{
  "$schema": "../../../schemas/spells/v1.0.0/schema.json",
  "contract_version": "1.0.0",
  "id": "spells:evoker-spell-spell-0465",
  "slug": "evoker-spell-spell-0465",
  "family": "spells",
  "version": "1.0.0",
  "authority": "declarative",
  "intended_consumers": [
    "llm-pipeline",
    "zig-server-v2"
  ],
  "compatibility": [],
  "dependencies": [],
  "spec_checksum": "sha256:7a48e9b73745c216759cced3364046d8998623473ac77f5d283c1998c83b2704",
  "spec": {
    "display_name": "Evoker Spell Spell 0465",
    "school": "evoker-spell-spell-0465-spell",
    "rarity": "common",
    "spell_kind": "damage",
    "target_kind": "single"
  }
}
