{
  "$schema": "../../../schemas/spells/v1.0.0/schema.json",
  "contract_version": "1.0.0",
  "id": "spells:set-spell-spell-1263",
  "slug": "set-spell-spell-1263",
  "family": "spells",
  "version": "1.0.0",
  "authority": "declarative",
  "intended_consumers": [
    "llm-pipeline",
    "zig-server-v2"
  ],
  "compatibility": [],
  "dependencies": [],
  "spec_checksum": "sha256:32d7c3f0ae5af12d1e4bae13199701cb44b025dcaec89ddcf5326965e3c801a4",
  "spec": {
    "display_name": "Set Spell Spell 1263",
    "school": "set-set-spell-spell-1263",
    "rarity": "common",
    "spell_kind": "damage",
    "target_kind": "single"
  }
}
