{
  "$schema": "../../../schemas/abilities/v1.0.0/schema.json",
  "contract_version": "1.0.0",
  "id": "abilities:assassin-venomous-strike",
  "slug": "assassin-venomous-strike",
  "family": "abilities",
  "version": "1.0.0",
  "authority": "declarative",
  "intended_consumers": [
    "llm-pipeline"
  ],
  "compatibility": [],
  "dependencies": [],
  "spec_checksum": "sha256:aa5805e3650f8665dedc8a83a2f8a46954372eecd61ee057e4f518acdbfb72ac",
  "spec": {
    "display_name": "Frappe Venimeuse",
    "ability_kind": "active",
    "category_tag": "damage",
    "target_kind": "enemy"
  }
}
